<?xml version="1.0" encoding="UTF-8"?>
<xs:schema xmlns:xs="http://www.w3.org/2001/XMLSchema"
	elementFormDefault="qualified">
	<xs:include schemaLocation="CommonComponentConfiguration.xsd" />
	<xs:element name="compSystem">
		<xs:complexType>
			<xs:sequence>
				<xs:element ref="configVersion" />
				<xs:choice minOccurs="0" maxOccurs="unbounded">
					<xs:element ref="abstractComponent" />
                    <xs:element ref="concreteComponent" />
					<xs:element ref="toolkitComponent" />
				</xs:choice>
			</xs:sequence>
		</xs:complexType>
	</xs:element>
	<xs:element name="configVersion">
		<xs:complexType>
			<xs:sequence>
				<xs:element ref="majorVersion" />
				<xs:element ref="minorVersion" />
			</xs:sequence>
		</xs:complexType>
	</xs:element>
	<xs:element name="majorVersion" type="xs:string" />
	<xs:element name="minorVersion" type="xs:string" />
	<xs:element name="toolkitComponent">
		<xs:complexType>
			<xs:sequence>
				<xs:element minOccurs="0" maxOccurs="unbounded" ref="realizes" />
				<xs:element minOccurs="0" maxOccurs="unbounded" ref="extends" />
				<xs:element ref="testerClass" />
				<xs:element minOccurs="0" maxOccurs="1" ref="componentClass" />
				<xs:element minOccurs="0" maxOccurs="unbounded" ref="action" />
			</xs:sequence>
			<xs:attribute name="type" use="required" type="xs:ID" />
			<xs:attribute name="descriptionKey" use="optional" type="xs:string" />
			<xs:attribute name="visible" default="true" type="xs:boolean" />
			<xs:attribute name="hasDefaultMapping" default="false" type="xs:boolean" />
			<xs:attribute name="observable" default="true" type="xs:boolean" />
			<xs:attribute name="changed" use="optional"/>
			<xs:attribute name="deprecated" default="false" type="xs:boolean" />
            <xs:attribute name="since" use="optional" type="xs:string" />
            <xs:attribute name="supported" default="true" type="xs:boolean" />
		</xs:complexType>
	</xs:element>
	<xs:element name="abstractComponent">
		<xs:complexType>
			<xs:sequence>
				<xs:element minOccurs="0" maxOccurs="unbounded" ref="realizes" />
				<xs:element minOccurs="0" maxOccurs="unbounded" ref="extends" />
				<xs:element minOccurs="0" maxOccurs="unbounded" ref="action" />
			</xs:sequence>
			<xs:attribute name="type" use="required" type="xs:ID" />
			<xs:attribute name="descriptionKey" use="optional" type="xs:string" />
			<xs:attribute name="visible" default="true" type="xs:boolean" />
			<xs:attribute name="changed" use="optional"/>
			<xs:attribute name="deprecated" default="false" type="xs:boolean" />
            <xs:attribute name="since" use="optional" type="xs:string" />
		</xs:complexType>
	</xs:element>
	<xs:element name="testerClass" type="xs:string" />
	<xs:element name="componentClass">
		<xs:complexType>
			<xs:sequence>
				<xs:element minOccurs="0" maxOccurs="unbounded" ref="property" />
			</xs:sequence>
			<xs:attribute name="name" use="required" type="xs:string" />
		</xs:complexType>
	</xs:element>
	<xs:element name="property">
		<xs:complexType>
			<xs:attribute name="name" use="required" type="xs:string" />
			<xs:attribute name="value" use="required" type="xs:string" />
		</xs:complexType>
	</xs:element>
    <xs:element name="concreteComponent">
	    <xs:complexType>
	        <xs:sequence>
                <xs:element minOccurs="0" maxOccurs="unbounded" ref="realizes" />
                <xs:element minOccurs="0" maxOccurs="unbounded" ref="extends" />
                <xs:element minOccurs="0" maxOccurs="unbounded" ref="action" />
            </xs:sequence>
	      <xs:attribute name="type" use="required" type="xs:ID"/>
	      <xs:attribute name="descriptionKey" use="optional" type="xs:string" />
	      <xs:attribute name="visible" default="true" type="xs:boolean" />
	      <xs:attribute name="hasDefaultMapping" default="false" type="xs:boolean" />
	      <xs:attribute name="changed" use="optional"/>
	      <xs:attribute name="deprecated" default="false" type="xs:boolean" />
          <xs:attribute name="since" use="optional" type="xs:string" />
	    </xs:complexType>
    </xs:element></xs:schema>
