<?xml version="1.0" encoding="ISO-8859-1"?>
<!--
    Copyright (c) 2004, 2010 BREDEX GmbH.
    All rights reserved. This program and the accompanying materials
    are made available under the terms of the Eclipse Public License v1.0
    which accompanies this distribution, and is available at
    http://www.eclipse.org/legal/epl-v10.html
 -->
<compSystem xmlns:xsi="http://www.w3.org/2001/XMLSchema-instance" xsi:noNamespaceSchemaLocation="../../../org.eclipse.jubula.toolkit.common/resources/xml/ToolkitComponentConfiguration.xsd">
	<configVersion>
		<majorVersion>2</majorVersion>
		<minorVersion>1</minorVersion>
	</configVersion>
 
    <toolkitComponent type="org.eclipse.ui.internal.views.properties.tabbed.view.TabbedPropertyList" visible="false">
        <realizes>guidancer.concrete.List</realizes>
        <testerClass>org.eclipse.jubula.rc.common.tester.ListTester</testerClass>
        <componentClass name="org.eclipse.ui.internal.views.properties.tabbed.view.TabbedPropertyList" />
    </toolkitComponent>
</compSystem>